{
"id":"hematology.microbiology.epstein_barr_virus","domain":"Hematology","subject":"Microbiology","topic":"Epstein-Barr Virus","subtopic":"EBV biology, B-cell tropism, infectious mononucleosis, complications and diagnosis","concept":"Epstein-Barr virus (human herpesvirus 4) is a ubiquitous herpesvirus with B-cell tropism that establishes lifelong latency.","content":{"definition":"Primary EBV infection can cause infectious mononucleosis with fever, pharyngitis, lymphadenopathy and atypical lymphocytosis.","explanation":"EBV infects epithelial cells and B lymphocytes, then establishes lifelong latency in B cells.","mechanism":"The host immune response to infected B cells produces many clinical and hematologic features of infectious mononucleosis.","structure":"EBV is an enveloped DNA herpesvirus.","function":"Viral tropism for B cells and latency determine persistent infection and disease patterns.","causes":["Saliva is the major transmission route","Blood and transplanted tissues can transmit EBV in specific settings"],"effects":["Fever, pharyngitis and lymphadenopathy","Fatigue and atypical lymphocytosis","Splenomegaly may occur","Neurologic or severe disease can occur especially in immunocompromised patients"],"clinical_relevance":"Official Hematology microbiology syllabus topic.","diagnosis":"Heterophile antibody testing or EBV-specific serology is used according to age and clinical context; CBC findings support but do not alone establish infection.","treatment":"Management of uncomplicated infectious mononucleosis is mainly supportive; severe or complicated disease requires specialist management.","high_yield":["EBV is HHV-4","B-cell tropism and lifelong latency","Infectious mononucleosis causes atypical lymphocytosis","Fever, pharyngitis and lymphadenopathy are classic","Splenic enlargement is clinically important"]},"terminology":[{"term":"Infectious mononucleosis","language":"English","arabic":"داء كثرة الوحيدات العدوائية","pronunciation":"in-FEK-shus mon-oh-noo-klee-OH-sis","etymology":"Mono refers to mononuclear/monocytic blood-cell appearance.","notes":"Common clinical syndrome of primary EBV infection."},{"term":"Atypical lymphocyte","language":"English","arabic":"خلية لمفاوية غير نمطية","pronunciation":"ay-TIP-ih-kul LIM-foh-site","etymology":"Atypical means differing from the usual form.","notes":"Reactive lymphocyte commonly seen in infectious mononucleosis."}],"relations":[],"yemen_context":{"relevance":"Relevant to hematology and infectious-disease education; no unsupported Yemen-specific incidence is asserted.","evidence":"CDC evidence."},"evidence_level":"reference","status":"reviewed","review_notes":"Original synthesis based on CDC clinical overview.","last_verified":"2026-09-27","sources":[{"title":"CDC Clinical Overview of Epstein-Barr Virus","source_type":"reference","year":2024,"url":"https://www.cdc.gov/epstein-barr/hcp/clinical-overview/index.html","license":"CDC","location":"CDC","notes":"Clinical features and complications."}]
}