{
"id":"hematology.microbiology.lymphatic_filariasis","domain":"Hematology","subject":"Microbiology","topic":"Lymphatic Filariasis","subtopic":"Wuchereria and Brugia: transmission, life cycle, lymphatic disease, diagnosis and treatment","concept":"Lymphatic filariasis is a mosquito-borne helminthic infection caused mainly by Wuchereria bancrofti and Brugia species.","content":{"definition":"Adult filarial worms inhabit lymphatic vessels while microfilariae circulate in blood.","explanation":"Mosquitoes acquire microfilariae from infected blood and transmit infective larvae during later bites. Adult worms can cause lymphatic dilation and dysfunction.","mechanism":"Adult worms and host inflammatory responses damage lymphatic vessels; chronic disease can produce lymphedema, elephantiasis and hydrocele.","structure":"Major human pathogens include Wuchereria bancrofti, Brugia malayi and Brugia timori.","function":"The vector-host life cycle maintains transmission between infected people and mosquitoes.","causes":["Mosquito bites","Wuchereria bancrofti causes about 90% of global cases"],"effects":["Many infections are asymptomatic","Acute lymphangitis may occur","Chronic lymphedema, elephantiasis or hydrocele can develop"],"clinical_relevance":"Official Hematology microbiology syllabus topic.","diagnosis":"Blood microscopy for microfilariae and antigen or serologic tests are used according to species and setting.","treatment":"Treatment and mass drug administration depend on local epidemiology; diethylcarbamazine is used in appropriate settings, while chronic lymphatic damage also needs morbidity management.","high_yield":["Wuchereria bancrofti is the major species","Mosquito is the vector","Microfilariae circulate in blood","Adult worms damage lymphatics","Chronic disease may cause elephantiasis and hydrocele"]},"terminology":[{"term":"Microfilaria","language":"English","arabic":"الميكروفيلاريا","pronunciation":"my-kroh-fih-LAIR-ee-uh","etymology":"Micro means small; filaria refers to thread-like worms.","notes":"Larval form detected in blood."},{"term":"Elephantiasis","language":"English","arabic":"داء الفيل","pronunciation":"el-uh-fan-TY-uh-sis","etymology":"Refers to marked enlargement resembling an elephant limb.","notes":"Severe chronic lymphatic disease."}],"relations":[],"yemen_context":{"relevance":"Relevant to tropical infectious-disease education; no unsupported Yemen-specific incidence is asserted.","evidence":"CDC evidence."},"evidence_level":"guideline","status":"reviewed","review_notes":"Original synthesis based on CDC clinical overview.","last_verified":"2026-09-27","sources":[{"title":"CDC Clinical Overview of Lymphatic Filariasis","source_type":"guideline","year":2026,"url":"https://www.cdc.gov/filarial-worms/hcp/clinical-overview/index.html","license":"CDC","location":"CDC","notes":"Species, clinical features and diagnosis."}]
}