{
  "id": "hematology.medicine.blood_transfusion_precautions_reactions",
  "domain": "Hematology",
  "subject": "Medicine",
  "topic": "Blood Transfusion: Precautions and Reactions",
  "concept": "Safe transfusion requires appropriate indication, correct patient identification, compatibility testing, correct administration and monitoring.",
  "content": {
    "definition": "Safe transfusion requires appropriate indication, correct patient identification, compatibility testing, correct administration and monitoring.",
    "explanation": "Transfusion safety includes patient identification, sample labeling, ABO/Rh compatibility, antibody screening and crossmatching as appropriate, bedside verification and monitoring. Reactions may be immune or non-immune and acute or delayed.",
    "mechanism": "Transfusion safety includes patient identification, sample labeling, ABO/Rh compatibility, antibody screening and crossmatching as appropriate, bedside verification and monitoring. Reactions may be immune or non-immune and acute or delayed.",
    "clinical_relevance": "ABO-incompatible transfusion can cause severe acute hemolysis. Suspected transfusion reaction requires immediate assessment and transfusion-service involvement. Transfusion should be used when expected benefits outweigh risks.",
    "diagnosis": "Diagnosis uses the appropriate clinical, laboratory, microbiologic, marrow or blood-bank studies for the suspected condition.",
    "treatment": "Management is disease- and patient-specific and should follow current authoritative guidance.",
    "high_yield": [
      "ABO-incompatible transfusion can cause severe acute hemolysis.",
      "Suspected transfusion reaction requires immediate assessment and transfusion-service involvement.",
      "Transfusion should be used when expected benefits outweigh risks."
    ]
  },
  "terminology": [],
  "relations": [
    {
      "target_id": "hematology.physiology.blood_groups",
      "relation": "depends_on",
      "note": "ABO and Rh compatibility underpin safe transfusion."
    }
  ],
  "yemen_context": {
    "relevance": "Official Hematology Medicine block topic.",
    "evidence": "General evidence; no Yemen-specific regimen or availability asserted."
  },
  "evidence_level": "guideline",
  "status": "reviewed",
  "review_notes": "Original educational synthesis; not a patient-specific treatment protocol.",
  "last_verified": "2026-09-27",
  "sources": [
    {
      "title": "Safe and rational clinical use of blood",
      "source_type": "guideline",
      "authors": [
        "World Health Organization"
      ],
      "year": 2021,
      "url": "https://www.who.int/teams/health-product-policy-and-standards/standards-and-specifications/blood-and-products-of-human-origin/patient-blood-management-and-clinical-use-of-blood/clinical-use",
      "license": "WHO",
      "location": "WHO",
      "notes": "Clinical transfusion safety and rational use."
    },
    {
      "title": "Clinical transfusion process and patient safety",
      "source_type": "guideline",
      "authors": [
        "World Health Organization"
      ],
      "year": 2010,
      "url": "https://www.who.int/publications/i/item/WHO-EHT-10.05",
      "license": "WHO",
      "location": "WHO",
      "notes": "Identification, compatibility and monitoring."
    }
  ]
}
