{
  "id": "hematology.histology.rbc_erythropoiesis",
  "domain": "hematology",
  "subject": "Histology",
  "topic": "Red Blood Cell Structure, Function and Erythropoiesis",
  "subtopic": "Erythrocyte morphology, maturation and regulation",
  "concept": "Erythrocyte structure, function and erythropoiesis",
  "content": {
    "definition": "Erythrocytes are specialized, mature blood cells adapted for gas transport. Erythropoiesis is the regulated process by which erythroid cells develop from hematopoietic progenitors through erythroblasts and reticulocytes to mature red blood cells.",
    "explanation": "A mature human RBC is a flexible, biconcave, anucleate cell with a membrane-cytoskeleton system that preserves shape while allowing passage through small vessels. Loss of the nucleus and most organelles creates space for hemoglobin and prevents the mature cell from dividing or synthesizing new proteins. The biconcave form increases surface-area-to-volume ratio and supports efficient gas exchange and deformability. RBCs circulate for about 120 days before senescent cells are removed mainly by macrophages in the spleen, liver and bone marrow.",
    "mechanism": "Erythropoiesis begins with hematopoietic stem/progenitor cells and commitment to the erythroid lineage. Erythroid progenitors progress through proerythroblast, basophilic erythroblast, polychromatic erythroblast and orthochromatic erythroblast stages. During maturation, cell size decreases, nuclear chromatin condenses, hemoglobin accumulates and the nucleus is ultimately extruded. The resulting reticulocyte retains residual ribosomal RNA and matures into an erythrocyte after entering the circulation. Tissue oxygen availability regulates erythropoiesis largely through renal erythropoietin (EPO): reduced oxygen delivery stimulates EPO production, which promotes erythroid progenitor survival, proliferation and differentiation in bone marrow.",
    "structure": "The mature RBC contains a plasma membrane supported by a spectrin-based cytoskeleton with important membrane-associated proteins including ankyrin, band 3 and protein 4.1. It lacks a nucleus, mitochondria, endoplasmic reticulum and ribosomes. Hemoglobin is the dominant intracellular protein. The biconcave disc has a thin central region and thicker peripheral rim.",
    "function": "The principal function is transport of oxygen from the lungs to tissues and contribution to carbon dioxide transport from tissues to the lungs. Hemoglobin carries most blood oxygen. RBC carbonic anhydrase facilitates rapid conversion between carbon dioxide and bicarbonate, supporting CO2 transport and acid-base physiology. RBC deformability allows cells to traverse the microcirculation.",
    "causes": [],
    "effects": [],
    "clinical_relevance": "RBC morphology and reticulocyte production are central to anemia evaluation. Low reticulocyte production can indicate inadequate marrow response, whereas an appropriate reticulocytosis indicates increased erythropoietic activity. Abnormal membrane proteins can cause hereditary spherocytosis or related membrane disorders; altered hemoglobin can produce hemoglobinopathies; impaired erythropoiesis can occur with iron, vitamin B12 or folate deficiency, marrow failure and reduced EPO production.",
    "diagnosis": "RBC disorders are assessed with complete blood count and red-cell indices, peripheral blood smear, reticulocyte count and, when indicated, hemolysis studies, iron studies, vitamin levels, hemoglobin analysis and bone marrow examination. Reticulocyte assessment helps distinguish reduced production from increased loss or destruction.",
    "treatment": "Treatment depends on the underlying disorder and may include correction of iron, vitamin B12 or folate deficiency, treatment of bleeding or hemolysis, management of marrow disease, or erythropoiesis-stimulating therapy in selected settings such as some forms of chronic kidney disease.",
    "high_yield": [
      "Mature RBCs are biconcave, anucleate and highly deformable.",
      "The mature RBC lacks mitochondria, ribosomes and endoplasmic reticulum.",
      "Hemoglobin is the major intracellular protein and carries most blood oxygen.",
      "Normal RBC lifespan is approximately 120 days.",
      "Erythropoiesis proceeds through proerythroblast, basophilic, polychromatic and orthochromatic erythroblast stages, followed by reticulocyte and mature erythrocyte.",
      "The nucleus is extruded at the orthochromatic erythroblast stage, producing a reticulocyte.",
      "Reticulocytes contain residual ribosomal RNA and mature rapidly in peripheral blood.",
      "Reduced tissue oxygen availability increases renal EPO production and stimulates erythropoiesis.",
      "The spleen and liver are major sites for removal of senescent RBCs.",
      "The erythroblastic island contains developing erythroid cells around a central macrophage."
    ]
  },
  "terminology": [
    {
      "term": "Erythrocyte",
      "language": "English",
      "arabic": "كُرية الدم الحمراء",
      "pronunciation": "eh-RITH-roh-site",
      "etymology": "Greek erythros, red, plus kytos, cell.",
      "notes": "Mature red blood cell."
    },
    {
      "term": "Erythropoiesis",
      "language": "English",
      "arabic": "تكوّن كريات الدم الحمراء",
      "pronunciation": "eh-RITH-roh-poy-EE-sis",
      "etymology": "Erythro-, red, plus -poiesis, formation.",
      "notes": "Production and maturation of erythroid cells."
    },
    {
      "term": "Reticulocyte",
      "language": "English",
      "arabic": "الخُلية الشبكية",
      "pronunciation": "reh-TIK-yoo-loh-site",
      "etymology": "From Latin reticulum, a small net, referring to the residual RNA network.",
      "notes": "Immature RBC released after nuclear extrusion."
    },
    {
      "term": "Biconcave",
      "language": "English",
      "arabic": "ثنائي التقعر",
      "pronunciation": "bye-KON-kayv",
      "etymology": "Bi-, two, plus concave, hollowed inward.",
      "notes": "Disc shape with both surfaces concave toward the center."
    },
    {
      "term": "Erythroblast",
      "language": "English",
      "arabic": "الأرومة الحمراء",
      "pronunciation": "eh-RITH-roh-blast",
      "etymology": "Erythro-, red, plus blastos, germ or precursor.",
      "notes": "Developing nucleated erythroid cell."
    },
    {
      "term": "Erythropoietin (EPO)",
      "language": "English",
      "arabic": "الإريثروبويتين",
      "pronunciation": "eh-RITH-roh-POY-eh-tin",
      "etymology": "Erythro-, red, plus poietin, a substance promoting formation.",
      "notes": "Hormone produced mainly by the kidney that regulates erythropoiesis in response to tissue oxygenation."
    }
  ],
  "relations": [
    {
      "target_id": "hematology.histology.blood_tissue",
      "relation": "is_form_element_of",
      "note": "Erythrocytes are one of the formed elements of blood."
    },
    {
      "target_id": "hematology.anatomy.bone_marrow",
      "relation": "produced_in",
      "note": "Bone marrow is the principal site of erythropoiesis after birth under normal conditions."
    },
    {
      "target_id": "hematology.histology.fetal_hematopoiesis",
      "relation": "developmentally_continues_from",
      "note": "Definitive erythropoiesis develops within the broader sequence of fetal hematopoiesis before becoming established predominantly in postnatal bone marrow."
    }
  ],
  "yemen_context": {
    "relevance": "Foundational RBC histology relevant to anemia, hemoglobinopathies and interpretation of complete blood count and peripheral smear findings in medical education.",
    "evidence": "General medical relevance; no Yemen-specific epidemiologic claim is made in this record."
  },
  "sources": [
    {
      "title": "Histology, Red Blood Cell",
      "source_type": "reference",
      "authors": ["Laura Barbalato", "Leela Sharath Pillarisetty"],
      "year": 2022,
      "url": "https://www.ncbi.nlm.nih.gov/books/NBK539702/",
      "location": "NCBI Bookshelf",
      "notes": "RBC morphology, membrane-cytoskeleton structure, functions and lifespan."
    },
    {
      "title": "Embryology, Hematopoiesis",
      "source_type": "reference",
      "year": 2025,
      "url": "https://www.ncbi.nlm.nih.gov/books/NBK544245/",
      "location": "NCBI Bookshelf",
      "notes": "Erythroid progenitors, erythroblast maturation and EPO-dependent differentiation."
    },
    {
      "title": "Histology, Reticulocytes",
      "source_type": "reference",
      "year": 2023,
      "url": "https://www.ncbi.nlm.nih.gov/books/NBK542172/",
      "location": "NCBI Bookshelf",
      "notes": "Reticulocyte maturation, RNA remnants and clinical interpretation of reticulocyte count."
    },
    {
      "title": "Renewal by Multipotent Stem Cells: Blood Cell Formation",
      "source_type": "reference",
      "year": 2002,
      "url": "https://www.ncbi.nlm.nih.gov/books/NBK26919/",
      "location": "NCBI Bookshelf",
      "notes": "Erythrocyte maturation, organelle loss, lifespan and EPO regulation."
    },
    {
      "title": "Dynamics of Human Hematopoietic Stem and Progenitor Cell Differentiation to the Erythroid Lineage",
      "source_type": "review",
      "year": 2023,
      "url": "https://pmc.ncbi.nlm.nih.gov/articles/PMC10330572/",
      "location": "PubMed Central",
      "notes": "Human erythroid differentiation and developmental context."
    }
  ],
  "evidence_level": "reference",
  "status": "reviewed",
  "review_notes": "Original synthesized educational record based on the cited sources. Classical erythroid maturation stages are retained for histology teaching while acknowledging modern evidence for progenitor heterogeneity.",
  "last_verified": "2026-09-27"
}